[
  {
    "id": "BIO-01",
    "domain": "Biomedical & healthcare",
    "application": "MRI adaptive acquisition and sequence orchestration",
    "current_baseline": "Fixed or protocol-driven pulse sequences acquire k-space data and reconstruct images before downstream interpretation.",
    "proposed_role": "Use local anatomical/physiological support, motion and safety compatibility, and quantitative guard conditions to adapt which measurements are acquired next.",
    "boundary": "Addition to MRI acquisition and control; not a magnet replacement.",
    "maturity": "Near-term research pilot",
    "evidence": "Corpus pattern + established MRI precedent",
    "core_operators": "direct state query; next-event solve; local support; compatibility gate; guard/event surface; lineage/provenance",
    "exemplar_event_guard": "Acquire the next encoding block when predicted information gain or quantitative uncertainty crosses a declared threshold and safety constraints remain satisfied.",
    "auditable_absence": "Expected calibration, physiological gating or coil data fail to arrive within the sequence window despite verified sensor coverage.",
    "candidate_metrics": "Diagnostic task performance; scan time; acquired samples; SAR and gradient limits; motion artifacts; events/J; false-adaptation rate.",
    "minimum_pilot": "Retrospective raw-data replay, then a phantom or volunteer study with a locked protocol and conventional reconstruction reference.",
    "principal_risks": "Adaptive bias; missed pathology; instability; regulatory validation; patient safety.",
    "references": "C0; R1; R2; R3; R5"
  },
  {
    "id": "BIO-02",
    "domain": "Biomedical & healthcare",
    "application": "MRI physics-constrained direct parameter query",
    "current_baseline": "Conventional pipelines produce images, then estimate tissue or functional parameters.",
    "proposed_role": "Represent Bloch-model-compatible signal families as relations and query selected parameters or change events directly, optionally using images as a view.",
    "boundary": "Partial replacement of selected reconstruction stages for bounded tasks.",
    "maturity": "Research prototype",
    "evidence": "Cross-domain inference supported by quantitative MRI",
    "core_operators": "direct state query; local support; compatibility gate; guard/event surface; materialized view",
    "exemplar_event_guard": "Parameter posterior or certified interval enters a clinically meaningful range under sufficient acquisition support.",
    "auditable_absence": "A parameter cannot be certified because the required excitation/encoding support was never observed.",
    "candidate_metrics": "Parameter bias/variance; calibration; scan time; task AUC; reconstruction energy; uncertainty coverage.",
    "minimum_pilot": "Phantom study comparing direct parameter estimates, MRF-style matching and standard image-first workflow.",
    "principal_risks": "Model mismatch; dictionary/expression growth; non-identifiability; clinical interpretability.",
    "references": "C0; R3; R4"
  },
  {
    "id": "BIO-03",
    "domain": "Biomedical & healthcare",
    "application": "MRI narrow diagnostic instrument as an alternative to full imaging",
    "current_baseline": "Full MRI forms general-purpose images even when the clinical question is narrow.",
    "proposed_role": "Design a task-specific MR instrument that answers a bounded question such as relaxation change, flow threshold or lesion-presence probability without requiring a full diagnostic image.",
    "boundary": "Alternative narrow instrument; full MRI replacement unsupported.",
    "maturity": "Frontier concept",
    "evidence": "Pilot hypothesis",
    "core_operators": "direct state query; local support; compatibility gate; guard/event surface; materialized view",
    "exemplar_event_guard": "A task-specific signal relation crosses a validated threshold with confidence and safety conditions satisfied.",
    "auditable_absence": "The expected signal support is absent, but only after coil, sequence and coverage integrity are verified.",
    "candidate_metrics": "Sensitivity/specificity; acquisition time; energy; footprint; cost; inconclusive rate; referral-to-full-MRI rate.",
    "minimum_pilot": "Start with a benchtop NMR/MR phantom and a single quantitative task.",
    "principal_risks": "Loss of generality; hidden confounders; regulatory burden; false reassurance.",
    "references": "C0; R1; R4; R5"
  },
  {
    "id": "BIO-04",
    "domain": "Biomedical & healthcare",
    "application": "MRI motion, respiratory and cardiac event gating",
    "current_baseline": "Motion correction often relies on repeated acquisition, navigators or retrospective processing.",
    "proposed_role": "Treat motion/physiology as continuous state and solve for compatible acquisition windows or correction events rather than replaying uniform frames.",
    "boundary": "Addition.",
    "maturity": "Near-term pilot",
    "evidence": "Established component + corpus mapping",
    "core_operators": "next-event solve; local support; compatibility gate; guard/event surface; auditable absence",
    "exemplar_event_guard": "Predicted motion enters an admissible window and a sequence block is admitted; otherwise hold or redirect.",
    "auditable_absence": "A required quiet-window event never occurs within the allowed interval.",
    "candidate_metrics": "Rejected acquisitions; reacquisition rate; image/parameter quality; latency; patient time.",
    "minimum_pilot": "Integrate an external motion sensor with retrospective MR sequence logs.",
    "principal_risks": "Sensor drift; phase mismatch; prolonged scans; selection bias.",
    "references": "C0; R1; R3"
  },
  {
    "id": "BIO-05",
    "domain": "Biomedical & healthcare",
    "application": "MRI safety and implant compatibility engine",
    "current_baseline": "Safety screening is document- and workflow-heavy and can fail when implant identity or conditions are incomplete.",
    "proposed_role": "Model implant identity, field strength, sequence limits and patient state as a compatibility predicate with provenance and explicit reason codes.",
    "boundary": "Addition to safety workflow.",
    "maturity": "Implementable integration",
    "evidence": "Standards/guidance + corpus compatibility",
    "core_operators": "compatibility gate; lineage/provenance; auditable absence; guard/event surface",
    "exemplar_event_guard": "Scan becomes admissible only when all required device attributes and MR-conditional constraints are present and current.",
    "auditable_absence": "Missing implant identity or condition is logged as a blocking absence, not silently treated as safe.",
    "candidate_metrics": "Screening completeness; prevented unsafe scans; delay time; override rate; auditability.",
    "minimum_pilot": "FHIR-compatible registry and rules engine in one MRI service line.",
    "principal_risks": "Incorrect device metadata; stale labeling; workflow bypass; privacy.",
    "references": "C0; R5; R6"
  },
  {
    "id": "BIO-06",
    "domain": "Biomedical & healthcare",
    "application": "Ultrasound echo-event acquisition and beam control",
    "current_baseline": "Uniform RF sampling and image formation precede measurement of most clinical features.",
    "proposed_role": "Use level-crossing or feature-triggered acquisition, local beam support and direct arrival-time/flow events to reduce irrelevant conversion and processing.",
    "boundary": "Addition or partial replacement of acquisition/reconstruction for narrow tasks.",
    "maturity": "Research prototype",
    "evidence": "Cross-domain inference + event ADC precedent",
    "core_operators": "next-event solve; local support; guard/event surface; analog/photonic front end; materialized view",
    "exemplar_event_guard": "Echo arrival, Doppler shift or tissue-boundary relation crosses a validated threshold within the beam support.",
    "auditable_absence": "Expected echo absent only when transducer contact and acoustic coverage are verified.",
    "candidate_metrics": "Samples/event; energy; latency; sensitivity; localization error; image equivalence when a view is produced.",
    "minimum_pilot": "Phantom and flow-loop test with simultaneous conventional RF capture.",
    "principal_risks": "Information loss; nonlinear propagation; aliasing; difficult certification.",
    "references": "C0; R31"
  },
  {
    "id": "BIO-07",
    "domain": "Biomedical & healthcare",
    "application": "CT/PET task-specific sparse acquisition",
    "current_baseline": "Tomographic systems acquire projections and reconstruct volumetric images before many decisions.",
    "proposed_role": "Select measurement supports adaptively and solve for bounded findings or quantitative changes with explicit uncertainty, retaining full reconstruction as fallback.",
    "boundary": "Addition/partial replacement in bounded tasks.",
    "maturity": "Research concept",
    "evidence": "Cross-domain inference",
    "core_operators": "direct state query; local support; compatibility gate; guard/event surface; materialized view",
    "exemplar_event_guard": "Task confidence reaches a preset boundary without violating dose/count constraints.",
    "auditable_absence": "A required angular or count support is absent; result remains inconclusive rather than negative.",
    "candidate_metrics": "Dose or tracer counts; task performance; scan time; uncertainty; fallback rate.",
    "minimum_pilot": "Digital phantom and archived raw-data challenge.",
    "principal_risks": "Dose-selection bias; hallucinated structure; regulatory validation.",
    "references": "C0"
  },
  {
    "id": "BIO-08",
    "domain": "Biomedical & healthcare",
    "application": "Microscopy and cell-culture event microscope",
    "current_baseline": "High-throughput microscopy generates large image stacks that are later searched for rare events.",